{
  "$schema": "https://raw.githubusercontent.com/LILYGO-UI/packages/main/runtime-release.schema.json",
  "schema_version": 1,
  "status": "published",
  "submitted_by": "lbuque",
  "manifest": {
    "$schema": "https://raw.githubusercontent.com/LILYGO-UI/packages/main/runtime-release.schema.json",
    "schema_version": 1,
    "package": "meshtasticd",
    "version": "2.8.0.0+lilygo1",
    "compatibility": {
      "architectures": [
        "arm64"
      ]
    }
  },
  "artifact": {
    "architecture": "arm64",
    "size": 2239072,
    "sha256": "f44e5675acadfcad20897e8e54fd752ff2ecf7fcbdb4e790b7f9b6e7b1189a3b",
    "media_type": "application/vnd.debian.binary-package",
    "source": {
      "repository": "lbuque/packages",
      "tag": "lpm-staging-meshtasticd-2.8.0.0-lilygo1-f44e5675acad",
      "asset": "sha256-f44e5675acadfcad20897e8e54fd752ff2ecf7fcbdb4e790b7f9b6e7b1189a3b.deb",
      "url": "https://github.com/lbuque/packages/releases/download/lpm-staging-meshtasticd-2.8.0.0-lilygo1-f44e5675acad/sha256-f44e5675acadfcad20897e8e54fd752ff2ecf7fcbdb4e790b7f9b6e7b1189a3b.deb"
    },
    "central": {
      "repository": "LILYGO-UI/packages",
      "tag": "apt-pool-meshtasticd",
      "asset": "sha256-f44e5675acadfcad20897e8e54fd752ff2ecf7fcbdb4e790b7f9b6e7b1189a3b.deb",
      "url": "https://github.com/LILYGO-UI/packages/releases/download/apt-pool-meshtasticd/sha256-f44e5675acadfcad20897e8e54fd752ff2ecf7fcbdb4e790b7f9b6e7b1189a3b.deb"
    }
  }
}
